[
    {
        "id": "E01",
        "day": "2026-09-10",
        "venueId": "V1",
        "performerId": "P01",
        "startTime": "10:00",
        "endTime": "11:30"
    },
    {
        "id": "E02",
        "day": "2026-09-10",
        "venueId": "V2",
        "performerId": "P02",
        "startTime": "10:15",
        "endTime": "11:45"
    }
]